{
  "format": "little-king.battle-layout",
  "version": 2,
  "meta": {
    "id": "map-9da12943-3e8d-4970-bb6e-525d8c79f88d",
    "title": "高地伏击 · 双路增援",
    "description": "草丛中的骷髅射手伏击中路，沼泽拖慢推进；远程单位和法术处理高山守军。篝火形成绕行点。三种一次性波次与银币出牌同时运作。",
    "createdAt": "2026-10-08T14:37:37.207Z",
    "updatedAt": "2026-10-08T14:37:37.207Z"
  },
  "field": {
    "width": 40,
    "height": 24,
    "grid": 1
  },
  "settings": {
    "encounterId": "Patrol",
    "seed": 12345,
    "battleTimeLimit": 300
  },
  "objects": [
    {
      "id": "obj-f150c32f-0ef8-4b73-8ccd-e32ca4024e48",
      "moduleId": "player-zone",
      "label": "我方部署区",
      "x": 5,
      "y": 12,
      "width": 8,
      "height": 16,
      "rotation": 0,
      "team": "player",
      "count": 1,
      "spawnAtSeconds": 0,
      "note": ""
    },
    {
      "id": "obj-89c1c99b-e0ee-46be-bc96-74696fd606d7",
      "moduleId": "brush",
      "label": "草丛",
      "x": 24,
      "y": 7,
      "width": 8,
      "height": 4,
      "rotation": 0,
      "team": "neutral",
      "count": 1,
      "spawnAtSeconds": 0,
      "note": ""
    },
    {
      "id": "obj-5eae4cb0-1772-4dec-a20e-d8a35790b7b5",
      "moduleId": "brush",
      "label": "草丛",
      "x": 30,
      "y": 7,
      "width": 5,
      "height": 4,
      "rotation": 0,
      "team": "neutral",
      "count": 1,
      "spawnAtSeconds": 0,
      "note": "与左侧草丛重叠，构成同一连通片。"
    },
    {
      "id": "obj-4a5e2d20-8507-4ca3-8d6b-dee2feb68b26",
      "moduleId": "swamp",
      "label": "沼泽",
      "x": 21,
      "y": 16,
      "width": 8,
      "height": 5,
      "rotation": 0,
      "team": "neutral",
      "count": 1,
      "spawnAtSeconds": 0,
      "note": ""
    },
    {
      "id": "obj-bafa61a7-f36f-427a-907f-3ce2237d272d",
      "moduleId": "campfire",
      "label": "军营篝火",
      "x": 16,
      "y": 12,
      "width": 2,
      "height": 2,
      "rotation": 0,
      "team": "neutral",
      "count": 1,
      "spawnAtSeconds": 0,
      "note": ""
    },
    {
      "id": "obj-ce04221c-574c-427d-91a5-e0f547e4e082",
      "moduleId": "mountain",
      "label": "高山",
      "x": 33,
      "y": 17,
      "width": 7,
      "height": 5,
      "rotation": 0,
      "team": "neutral",
      "count": 1,
      "spawnAtSeconds": 0,
      "note": "山上驻守固定；地面近战无法攻击。"
    },
    {
      "id": "obj-9116910d-da27-4cb7-a699-2ce8480bbe74",
      "moduleId": "skeleton-archer",
      "label": "骷髅射手",
      "x": 33,
      "y": 17,
      "width": 0.8,
      "height": 0.8,
      "rotation": 0,
      "team": "enemy",
      "count": 3,
      "spawnAtSeconds": 0,
      "note": "高山远程守军。"
    },
    {
      "id": "obj-3dd70f1a-c821-4954-9897-1afd6d2dd999",
      "moduleId": "skeleton-archer",
      "label": "骷髅射手",
      "x": 25,
      "y": 7,
      "width": 0.8,
      "height": 0.8,
      "rotation": 0,
      "team": "enemy",
      "count": 3,
      "spawnAtSeconds": 0,
      "note": "草丛伏兵。"
    },
    {
      "id": "obj-d19e3c1d-eba4-4066-bb8e-c549d1094519",
      "moduleId": "necromancer",
      "label": "伏击指挥官",
      "x": 36,
      "y": 10,
      "width": 1.2,
      "height": 1.2,
      "rotation": 0,
      "team": "enemy",
      "count": 1,
      "spawnAtSeconds": 0,
      "note": ""
    }
  ],
  "enemy": {
    "usesCards": true,
    "cards": [
      "Unit_Skeleton",
      "Unit_SkeletonArcher",
      "Spell_SkeletonCircle"
    ],
    "silverPerSecond": 1.5,
    "silverCap": 20,
    "startingSilver": 5
  },
  "waves": [
    {
      "id": "wave-b13c0e17-2a56-4f4b-bd49-d4dc5bb7bb1f",
      "label": "开战 15 秒近战增援",
      "trigger": "time",
      "time": 15,
      "targetId": "",
      "healthThreshold": 0.5,
      "unitId": "Unit_Skeleton",
      "count": 5,
      "x": 29,
      "y": 12,
      "radius": 2
    },
    {
      "id": "wave-fc67e9ae-68cd-493a-8389-3557b8e2ca5a",
      "label": "指挥官首次半血呼援",
      "trigger": "hero-health-below",
      "time": 2,
      "targetId": "obj-d19e3c1d-eba4-4066-bb8e-c549d1094519",
      "healthThreshold": 0.5,
      "unitId": "Unit_SkeletonArcher",
      "count": 4,
      "x": 34,
      "y": 5,
      "radius": 1.5
    },
    {
      "id": "wave-5dc6284b-94be-4fa2-a727-2d3af66682ac",
      "label": "指挥官首次倒下后增援",
      "trigger": "hero-first-death",
      "time": 1,
      "targetId": "obj-d19e3c1d-eba4-4066-bb8e-c549d1094519",
      "healthThreshold": 0.5,
      "unitId": "Hero_SkeletonGiant",
      "count": 1,
      "x": 36,
      "y": 12,
      "radius": 1
    }
  ]
}
